,budget,genres,homepage,id,keywords,original_language,original_title,overview,popularity,production_companies,production_countries,release_date,revenue,runtime,spoken_languages,status,tagline,title,vote_average,vote_count
2,245000000,"[{""id"": 28, ""name"": ""Action""}, {""id"": 12, ""name"": ""Adventure""}, {""id"": 80, ""name"": ""Crime""}]",http://www.sonypictures.com/movies/spectre/,206647,"[{""id"": 470, ""name"": ""spy""}, {""id"": 818, ""name"": ""based on novel""}, {""id"": 4289, ""name"": ""secret agent""}, {""id"": 9663, ""name"": ""sequel""}, {""id"": 14555, ""name"": ""mi6""}, {""id"": 156095, ""name"": ""british secret service""}, {""id"": 158431, ""name"": ""united kingdom""}]",en,Spectre,"A cryptic message from Bond’s past sends him on a trail to uncover a sinister organization. While M battles political forces to keep the secret service alive, Bond peels back the layers of deceit to reveal the terrible truth behind SPECTRE.",107.37678799999999,"[{""name"": ""Columbia Pictures"", ""id"": 5}, {""name"": ""Danjaq"", ""id"": 10761}, {""name"": ""B24"", ""id"": 69434}]","[{""iso_3166_1"": ""GB"", ""name"": ""United Kingdom""}, {""iso_3166_1"": ""US"", ""name"": ""United States of America""}]",2015-10-26 00:00:00,880674609,148.0,"[{""iso_639_1"": ""fr"", ""name"": ""Fran\u00e7ais""}, {""iso_639_1"": ""en"", ""name"": ""English""}, {""iso_639_1"": ""es"", ""name"": ""Espa\u00f1ol""}, {""iso_639_1"": ""it"", ""name"": ""Italiano""}, {""iso_639_1"": ""de"", ""name"": ""Deutsch""}]",Released,A Plan No One Escapes,Spectre,6.3,4466
7,280000000,"[{""id"": 28, ""name"": ""Action""}, {""id"": 12, ""name"": ""Adventure""}, {""id"": 878, ""name"": ""Science Fiction""}]",http://marvel.com/movies/movie/193/avengers_age_of_ultron,99861,"[{""id"": 8828, ""name"": ""marvel comic""}, {""id"": 9663, ""name"": ""sequel""}, {""id"": 9715, ""name"": ""superhero""}, {""id"": 9717, ""name"": ""based on comic book""}, {""id"": 10629, ""name"": ""vision""}, {""id"": 155030, ""name"": ""superhero team""}, {""id"": 179431, ""name"": ""duringcreditsstinger""}, {""id"": 180547, ""name"": ""marvel cinematic universe""}, {""id"": 209714, ""name"": ""3d""}]",en,Avengers: Age of Ultron,"When Tony Stark tries to jumpstart a dormant peacekeeping program, things go awry and Earth’s Mightiest Heroes are put to the ultimate test as the fate of the planet hangs in the balance. As the villainous Ultron emerges, it is up to The Avengers to stop him from enacting his terrible plans, and soon uneasy alliances and unexpected action pave the way for an epic and unique global adventure.",134.27922900000002,"[{""name"": ""Marvel Studios"", ""id"": 420}, {""name"": ""Prime Focus"", ""id"": 15357}, {""name"": ""Revolution Sun Studios"", ""id"": 76043}]","[{""iso_3166_1"": ""US"", ""name"": ""United States of America""}]",2015-04-22 00:00:00,1405403694,141.0,"[{""iso_639_1"": ""en"", ""name"": ""English""}]",Released,A New Age Has Come.,Avengers: Age of Ultron,7.3,6767
9,250000000,"[{""id"": 28, ""name"": ""Action""}, {""id"": 12, ""name"": ""Adventure""}, {""id"": 14, ""name"": ""Fantasy""}]",http://www.batmanvsupermandawnofjustice.com/,209112,"[{""id"": 849, ""name"": ""dc comics""}, {""id"": 7002, ""name"": ""vigilante""}, {""id"": 9715, ""name"": ""superhero""}, {""id"": 9717, ""name"": ""based on comic book""}, {""id"": 9748, ""name"": ""revenge""}, {""id"": 163455, ""name"": ""super powers""}, {""id"": 195242, ""name"": ""clark kent""}, {""id"": 195243, ""name"": ""bruce wayne""}, {""id"": 229266, ""name"": ""dc extended universe""}]",en,Batman v Superman: Dawn of Justice,"Fearing the actions of a god-like Super Hero left unchecked, Gotham City’s own formidable, forceful vigilante takes on Metropolis’s most revered, modern-day savior, while the world wrestles with what sort of hero it really needs. And with Batman and Superman at war with one another, a new threat quickly arises, putting mankind in greater danger than it’s ever known before.",155.790452,"[{""name"": ""DC Comics"", ""id"": 429}, {""name"": ""Atlas Entertainment"", ""id"": 507}, {""name"": ""Warner Bros."", ""id"": 6194}, {""name"": ""DC Entertainment"", ""id"": 9993}, {""name"": ""Cruel & Unusual Films"", ""id"": 9995}, {""name"": ""RatPac-Dune Entertainment"", ""id"": 41624}]","[{""iso_3166_1"": ""US"", ""name"": ""United States of America""}]",2016-03-23 00:00:00,873260194,151.0,"[{""iso_639_1"": ""en"", ""name"": ""English""}]",Released,Justice or revenge,Batman v Superman: Dawn of Justice,5.7,7004
19,250000000,"[{""id"": 28, ""name"": ""Action""}, {""id"": 12, ""name"": ""Adventure""}, {""id"": 14, ""name"": ""Fantasy""}]",http://www.thehobbit.com/,122917,"[{""id"": 417, ""name"": ""corruption""}, {""id"": 603, ""name"": ""elves""}, {""id"": 604, ""name"": ""dwarves""}, {""id"": 606, ""name"": ""orcs""}, {""id"": 609, ""name"": ""middle-earth (tolkien)""}, {""id"": 611, ""name"": ""hobbit""}, {""id"": 12554, ""name"": ""dragon""}, {""id"": 14643, ""name"": ""battle""}, {""id"": 167982, ""name"": ""unlikely friendship""}, {""id"": 188270, ""name"": ""epic battle""}, {""id"": 234213, ""name"": ""sword and sorcery""}]",en,The Hobbit: The Battle of the Five Armies,"Immediately after the events of The Desolation of Smaug, Bilbo and the dwarves try to defend Erebor's mountain of treasure from others who claim it: the men of the ruined Laketown and the elves of Mirkwood. Meanwhile an army of Orcs led by Azog the Defiler is marching on Erebor, fueled by the rise of the dark lord Sauron. Dwarves, elves and men must unite, and the hope for Middle-Earth falls into Bilbo's hands.",120.96574299999999,"[{""name"": ""WingNut Films"", ""id"": 11}, {""name"": ""New Line Cinema"", ""id"": 12}, {""name"": ""Warner Bros. Pictures"", ""id"": 174}, {""name"": ""3Foot7"", ""id"": 7413}, {""name"": ""Metro-Goldwyn-Mayer (MGM)"", ""id"": 8411}]","[{""iso_3166_1"": ""NZ"", ""name"": ""New Zealand""}, {""iso_3166_1"": ""US"", ""name"": ""United States of America""}]",2014-12-10 00:00:00,956019788,144.0,"[{""iso_639_1"": ""en"", ""name"": ""English""}]",Released,Witness the defining chapter of the Middle-Earth saga,The Hobbit: The Battle of the Five Armies,7.1,4760
26,250000000,"[{""id"": 12, ""name"": ""Adventure""}, {""id"": 28, ""name"": ""Action""}, {""id"": 878, ""name"": ""Science Fiction""}]",http://marvel.com/captainamericapremiere,271110,"[{""id"": 393, ""name"": ""civil war""}, {""id"": 6091, ""name"": ""war""}, {""id"": 8828, ""name"": ""marvel comic""}, {""id"": 9663, ""name"": ""sequel""}, {""id"": 9715, ""name"": ""superhero""}, {""id"": 9717, ""name"": ""based on comic book""}, {""id"": 156395, ""name"": ""imax""}, {""id"": 179430, ""name"": ""aftercreditsstinger""}, {""id"": 179431, ""name"": ""duringcreditsstinger""}, {""id"": 180547, ""name"": ""marvel cinematic universe""}, {""id"": 209714, ""name"": ""3d""}]",en,Captain America: Civil War,"Following the events of Age of Ultron, the collective governments of the world pass an act designed to regulate all superhuman activity. This polarizes opinion amongst the Avengers, causing two factions to side with Iron Man or Captain America, which causes an epic battle between former allies.",198.37239499999998,"[{""name"": ""Studio Babelsberg"", ""id"": 264}, {""name"": ""Marvel Studios"", ""id"": 420}, {""name"": ""Walt Disney Studios Motion Pictures"", ""id"": 3036}, {""name"": ""Vita-Ray Dutch Productions (III)"", ""id"": 84424}, {""name"": ""Deluxe Digital Studios"", ""id"": 84425}]","[{""iso_3166_1"": ""US"", ""name"": ""United States of America""}]",2016-04-27 00:00:00,1153304495,147.0,"[{""iso_639_1"": ""ro"", ""name"": ""Rom\u00e2n\u0103""}, {""iso_639_1"": ""en"", ""name"": ""English""}, {""iso_639_1"": ""de"", ""name"": ""Deutsch""}, {""iso_639_1"": ""ru"", ""name"": ""P\u0443\u0441\u0441\u043a\u0438\u0439""}]",Released,Divided We Fall,Captain America: Civil War,7.1,7241
28,150000000,"[{""id"": 28, ""name"": ""Action""}, {""id"": 12, ""name"": ""Adventure""}, {""id"": 878, ""name"": ""Science Fiction""}, {""id"": 53, ""name"": ""Thriller""}]",http://www.jurassicworld.com/,135397,"[{""id"": 1299, ""name"": ""monster""}, {""id"": 1718, ""name"": ""dna""}, {""id"": 1720, ""name"": ""tyrannosaurus rex""}, {""id"": 1766, ""name"": ""velociraptor""}, {""id"": 2041, ""name"": ""island""}, {""id"": 9663, ""name"": ""sequel""}, {""id"": 9937, ""name"": ""suspense""}, {""id"": 10617, ""name"": ""disaster""}, {""id"": 10685, ""name"": ""escape""}, {""id"": 12616, ""name"": ""dinosaur""}, {""id"": 155582, ""name"": ""amusement park""}, {""id"": 158130, ""name"": ""animal attack""}, {""id"": 158340, ""name"": ""theme park""}, {""id"": 178010, ""name"": ""jurassic park""}, {""id"": 209714, ""name"": ""3d""}, {""id"": 223059, ""name"": ""animal horror""}]",en,Jurassic World,"Twenty-two years after the events of Jurassic Park, Isla Nublar now features a fully functioning dinosaur theme park, Jurassic World, as originally envisioned by John Hammond.",418.708552,"[{""name"": ""Universal Studios"", ""id"": 13}, {""name"": ""Amblin Entertainment"", ""id"": 56}, {""name"": ""Legendary Pictures"", ""id"": 923}, {""name"": ""Fuji Television Network"", ""id"": 3341}, {""name"": ""Dentsu"", ""id"": 6452}]","[{""iso_3166_1"": ""US"", ""name"": ""United States of America""}]",2015-06-09 00:00:00,1513528810,124.0,"[{""iso_639_1"": ""en"", ""name"": ""English""}]",Released,The park is open.,Jurassic World,6.5,8662
36,210000000,"[{""id"": 878, ""name"": ""Science Fiction""}, {""id"": 28, ""name"": ""Action""}, {""id"": 12, ""name"": ""Adventure""}]",http://www.transformersmovie.com,91314,"[{""id"": 9663, ""name"": ""sequel""}, {""id"": 9951, ""name"": ""alien""}, {""id"": 10607, ""name"": ""transformers""}, {""id"": 10891, ""name"": ""giant robot""}, {""id"": 14544, ""name"": ""robot""}, {""id"": 156395, ""name"": ""imax""}, {""id"": 166594, ""name"": ""transforming robot""}]",en,Transformers: Age of Extinction,"As humanity picks up the pieces, following the conclusion of ""Transformers: Dark of the Moon,"" Autobots and Decepticons have all but vanished from the face of the planet. However, a group of powerful, ingenious businessman and scientists attempt to learn from past Transformer incursions and push the boundaries of technology beyond what they can control - all while an ancient, powerful Transformer menace sets Earth in his cross-hairs.",116.840296,"[{""name"": ""Paramount Pictures"", ""id"": 4}, {""name"": ""Amblin Entertainment"", ""id"": 56}, {""name"": ""Di Bonaventura Pictures"", ""id"": 435}, {""name"": ""Platinum Dunes"", ""id"": 2481}, {""name"": ""China Movie Channel"", ""id"": 11413}, {""name"": ""Hasbro Studios"", ""id"": 22826}, {""name"": ""Ian Bryce Productions"", ""id"": 38833}, {""name"": ""Revolution Sun Studios"", ""id"": 76043}]","[{""iso_3166_1"": ""US"", ""name"": ""United States of America""}]",2014-06-25 00:00:00,1091405097,165.0,"[{""iso_639_1"": ""en"", ""name"": ""English""}]",Released,This is not war. It's extinction.,Transformers: Age of Extinction,5.8,3095
38,200000000,"[{""id"": 28, ""name"": ""Action""}, {""id"": 12, ""name"": ""Adventure""}, {""id"": 14, ""name"": ""Fantasy""}]",http://www.theamazingspiderman.com,102382,"[{""id"": 1523, ""name"": ""obsession""}, {""id"": 8828, ""name"": ""marvel comic""}, {""id"": 9663, ""name"": ""sequel""}, {""id"": 9717, ""name"": ""based on comic book""}, {""id"": 13040, ""name"": ""electrocution""}, {""id"": 33977, ""name"": ""medical experiment""}, {""id"": 41594, ""name"": ""electricity""}, {""id"": 163455, ""name"": ""super powers""}]",en,The Amazing Spider-Man 2,"For Peter Parker, life is busy. Between taking out the bad guys as Spider-Man and spending time with the person he loves, Gwen Stacy, high school graduation cannot come quickly enough. Peter has not forgotten about the promise he made to Gwen’s father to protect her by staying away, but that is a promise he cannot keep. Things will change for Peter when a new villain, Electro, emerges, an old friend, Harry Osborn, returns, and Peter uncovers new clues about his past.",89.270217,"[{""name"": ""Columbia Pictures"", ""id"": 5}, {""name"": ""Marvel Enterprises"", ""id"": 19551}, {""name"": ""Avi Arad Productions"", ""id"": 31828}, {""name"": ""Matt Tolmach Productions"", ""id"": 53462}]","[{""iso_3166_1"": ""US"", ""name"": ""United States of America""}]",2014-04-16 00:00:00,705717432,142.0,"[{""iso_639_1"": ""en"", ""name"": ""English""}]",Released,No more secrets.,The Amazing Spider-Man 2,6.5,4179
44,190000000,"[{""id"": 28, ""name"": ""Action""}]",http://www.furious7.com/,168259,"[{""id"": 830, ""name"": ""car race""}, {""id"": 3428, ""name"": ""speed""}, {""id"": 9748, ""name"": ""revenge""}, {""id"": 9937, ""name"": ""suspense""}, {""id"": 33885, ""name"": ""car""}, {""id"": 40870, ""name"": ""race""}, {""id"": 205399, ""name"": ""muscle car""}]",en,Furious 7,Deckard Shaw seeks revenge against Dominic Toretto and his family for his comatose brother.,102.32221700000001,"[{""name"": ""Universal Pictures"", ""id"": 33}, {""name"": ""Original Film"", ""id"": 333}, {""name"": ""Fuji Television Network"", ""id"": 3341}, {""name"": ""Dentsu"", ""id"": 6452}, {""name"": ""One Race Films"", ""id"": 7154}, {""name"": ""China Film Co."", ""id"": 40890}, {""name"": ""Qu\u00e9bec Production Services Tax Credit"", ""id"": 86352}, {""name"": ""Media Rights Capital (MRC)"", ""id"": 86655}, {""name"": ""Abu Dhabi Film Commission"", ""id"": 87857}, {""name"": ""Colorado Office of Film, Television & Media"", ""id"": 87858}]","[{""iso_3166_1"": ""JP"", ""name"": ""Japan""}, {""iso_3166_1"": ""US"", ""name"": ""United States of America""}]",2015-04-01 00:00:00,1506249360,137.0,"[{""iso_639_1"": ""en"", ""name"": ""English""}]",Released,Vengeance Hits Home,Furious 7,7.3,4176
46,250000000,"[{""id"": 28, ""name"": ""Action""}, {""id"": 12, ""name"": ""Adventure""}, {""id"": 14, ""name"": ""Fantasy""}, {""id"": 878, ""name"": ""Science Fiction""}]",http://www.x-menmovies.com/,127585,"[{""id"": 1228, ""name"": ""1970s""}, {""id"": 1852, ""name"": ""mutant""}, {""id"": 4379, ""name"": ""time travel""}, {""id"": 8828, ""name"": ""marvel comic""}, {""id"": 9717, ""name"": ""based on comic book""}, {""id"": 10761, ""name"": ""superhuman""}, {""id"": 14527, ""name"": ""storm""}, {""id"": 161271, ""name"": ""beast""}, {""id"": 179430, ""name"": ""aftercreditsstinger""}, {""id"": 206736, ""name"": ""changing the past or future""}]",en,X-Men: Days of Future Past,The ultimate X-Men ensemble fights a war for the survival of the species across two time periods as they join forces with their younger selves in an epic battle that must change the past – to save our future.,118.07869099999999,"[{""name"": ""Twentieth Century Fox Film Corporation"", ""id"": 306}, {""name"": ""Donners' Company"", ""id"": 431}, {""name"": ""Marvel Entertainment"", ""id"": 7505}, {""name"": ""Bad Hat Harry Productions"", ""id"": 9168}, {""name"": ""TSG Entertainment"", ""id"": 22213}, {""name"": ""Down Productions"", ""id"": 37336}, {""name"": ""Revolution Sun Studios"", ""id"": 76043}]","[{""iso_3166_1"": ""GB"", ""name"": ""United Kingdom""}, {""iso_3166_1"": ""US"", ""name"": ""United States of America""}]",2014-05-15 00:00:00,747862775,131.0,"[{""iso_639_1"": ""en"", ""name"": ""English""}]",Released,"To save the future, they must alter the past",X-Men: Days of Future Past,7.5,6032
54,175000000,"[{""id"": 12, ""name"": ""Adventure""}, {""id"": 16, ""name"": ""Animation""}, {""id"": 10751, ""name"": ""Family""}]",http://movies.disney.com/the-good-dinosaur,105864,"[{""id"": 1720, ""name"": ""tyrannosaurus rex""}, {""id"": 9713, ""name"": ""friends""}, {""id"": 12026, ""name"": ""alternate history""}, {""id"": 12616, ""name"": ""dinosaur""}, {""id"": 13073, ""name"": ""fear""}, {""id"": 14527, ""name"": ""storm""}, {""id"": 18330, ""name"": ""nature""}, {""id"": 187864, ""name"": ""human""}, {""id"": 189092, ""name"": ""journey""}]",en,The Good Dinosaur,An epic journey into the world of dinosaurs where an Apatosaurus named Arlo makes an unlikely human friend.,51.692953,"[{""name"": ""Walt Disney Pictures"", ""id"": 2}, {""name"": ""Pixar Animation Studios"", ""id"": 3}]","[{""iso_3166_1"": ""US"", ""name"": ""United States of America""}]",2015-11-14 00:00:00,331926147,93.0,"[{""iso_639_1"": ""en"", ""name"": ""English""}]",Released,Little Arms With Big Attitude,The Good Dinosaur,6.6,1736
56,185000000,"[{""id"": 28, ""name"": ""Action""}, {""id"": 12, ""name"": ""Adventure""}, {""id"": 878, ""name"": ""Science Fiction""}]",http://www.startrekmovie.com/,188927,"[{""id"": 9663, ""name"": ""sequel""}, {""id"": 9743, ""name"": ""stranded""}, {""id"": 158449, ""name"": ""hatred""}, {""id"": 161176, ""name"": ""space opera""}]",en,Star Trek Beyond,"The USS Enterprise crew explores the furthest reaches of uncharted space, where they encounter a mysterious new enemy who puts them and everything the Federation stands for to the test.",65.352913,"[{""name"": ""Paramount Pictures"", ""id"": 4}, {""name"": ""Bad Robot"", ""id"": 11461}, {""name"": ""Perfect Storm Entertainment"", ""id"": 34530}, {""name"": ""Alibaba Pictures Group"", ""id"": 69484}, {""name"": ""Skydance Media"", ""id"": 82819}, {""name"": ""Sneaky Shark"", ""id"": 83644}, {""name"": ""Huahua Media"", ""id"": 83645}]","[{""iso_3166_1"": ""US"", ""name"": ""United States of America""}]",2016-07-07 00:00:00,343471816,122.0,"[{""iso_639_1"": ""en"", ""name"": ""English""}]",Released,,Star Trek Beyond,6.6,2568
61,176000003,"[{""id"": 878, ""name"": ""Science Fiction""}, {""id"": 14, ""name"": ""Fantasy""}, {""id"": 28, ""name"": ""Action""}, {""id"": 12, ""name"": ""Adventure""}]",http://www.jupiterascending.com,76757,"[{""id"": 306, ""name"": ""jupiter""}, {""id"": 9882, ""name"": ""space""}, {""id"": 187056, ""name"": ""woman director""}, {""id"": 209714, ""name"": ""3d""}, {""id"": 212760, ""name"": ""interspecies romance""}]",en,Jupiter Ascending,"In a universe where human genetic material is the most precious commodity, an impoverished young Earth woman becomes the key to strategic maneuvers and internal strife within a powerful dynasty…",85.36908000000001,"[{""name"": ""Village Roadshow Pictures"", ""id"": 79}, {""name"": ""Dune Entertainment"", ""id"": 444}, {""name"": ""Anarchos Productions"", ""id"": 450}, {""name"": ""Warner Bros."", ""id"": 6194}]","[{""iso_3166_1"": ""US"", ""name"": ""United States of America""}]",2015-02-04 00:00:00,183987723,124.0,"[{""iso_639_1"": ""en"", ""name"": ""English""}]",Released,Expand your universe.,Jupiter Ascending,5.2,2768
62,180000000,"[{""id"": 28, ""name"": ""Action""}, {""id"": 12, ""name"": ""Adventure""}]",http://legendoftarzan.com,258489,"[{""id"": 409, ""name"": ""africa""}, {""id"": 5650, ""name"": ""feral child""}, {""id"": 7347, ""name"": ""tarzan""}, {""id"": 10787, ""name"": ""jungle""}, {""id"": 158130, ""name"": ""animal attack""}]",en,The Legend of Tarzan,"Tarzan, having acclimated to life in London, is called back to his former home in the jungle to investigate the activities at a mining encampment.",42.741719,"[{""name"": ""Village Roadshow Pictures"", ""id"": 79}, {""name"": ""Dark Horse Entertainment"", ""id"": 552}, {""name"": ""Jerry Weintraub Productions"", ""id"": 2596}, {""name"": ""RatPac-Dune Entertainment"", ""id"": 41624}, {""name"": ""Beagle Pug Films"", ""id"": 46339}, {""name"": ""Riche Productions"", ""id"": 86565}, {""name"": ""Village Roadshow Films North America"", ""id"": 86566}]","[{""iso_3166_1"": ""CA"", ""name"": ""Canada""}, {""iso_3166_1"": ""GB"", ""name"": ""United Kingdom""}, {""iso_3166_1"": ""US"", ""name"": ""United States of America""}]",2016-06-29 00:00:00,356743061,109.0,"[{""iso_639_1"": ""en"", ""name"": ""English""}]",Released,Human. Nature.,The Legend of Tarzan,5.5,2430
64,178000000,"[{""id"": 878, ""name"": ""Science Fiction""}]",http://www.foxmovies.com/movies/x-men-apocalypse,246655,"[{""id"": 1852, ""name"": ""mutant""}, {""id"": 4769, ""name"": ""supernatural powers""}, {""id"": 8828, ""name"": ""marvel comic""}, {""id"": 9715, ""name"": ""superhero""}, {""id"": 9717, ""name"": ""based on comic book""}, {""id"": 10761, ""name"": ""superhuman""}, {""id"": 12332, ""name"": ""apocalypse""}, {""id"": 155030, ""name"": ""superhero team""}, {""id"": 176217, ""name"": ""world domination""}, {""id"": 179430, ""name"": ""aftercreditsstinger""}, {""id"": 208289, ""name"": ""1980s""}]",en,X-Men: Apocalypse,"After the re-emergence of the world's first mutant, world-destroyer Apocalypse, the X-Men must unite to defeat his extinction level plan.",139.272042,"[{""name"": ""Twentieth Century Fox Film Corporation"", ""id"": 306}, {""name"": ""Donners' Company"", ""id"": 431}, {""name"": ""Marvel Entertainment"", ""id"": 7505}, {""name"": ""Bad Hat Harry Productions"", ""id"": 9168}, {""name"": ""TSG Entertainment"", ""id"": 22213}, {""name"": ""Kinberg Genre"", ""id"": 78091}]","[{""iso_3166_1"": ""US"", ""name"": ""United States of America""}]",2016-05-18 00:00:00,543934787,144.0,"[{""iso_639_1"": ""en"", ""name"": ""English""}]",Released,Only the strong will survive,X-Men: Apocalypse,6.4,4721
72,175000000,"[{""id"": 28, ""name"": ""Action""}, {""id"": 12, ""name"": ""Adventure""}, {""id"": 80, ""name"": ""Crime""}, {""id"": 14, ""name"": ""Fantasy""}, {""id"": 878, ""name"": ""Science Fiction""}]",http://www.suicidesquad.com/,297761,"[{""id"": 849, ""name"": ""dc comics""}, {""id"": 1296, ""name"": ""shared universe""}, {""id"": 2095, ""name"": ""anti hero""}, {""id"": 3269, ""name"": ""secret mission""}, {""id"": 3289, ""name"": ""villain""}, {""id"": 9715, ""name"": ""superhero""}, {""id"": 194404, ""name"": ""supervillain""}, {""id"": 229266, ""name"": ""dc extended universe""}]",en,Suicide Squad,"From DC Comics comes the Suicide Squad, an antihero team of incarcerated supervillains who act as deniable assets for the United States government, undertaking high-risk black ops missions in exchange for commuted prison sentences.",90.23791999999999,"[{""name"": ""DC Comics"", ""id"": 429}, {""name"": ""Dune Entertainment"", ""id"": 444}, {""name"": ""Atlas Entertainment"", ""id"": 507}, {""name"": ""Warner Bros."", ""id"": 6194}, {""name"": ""DC Entertainment"", ""id"": 9993}]","[{""iso_3166_1"": ""US"", ""name"": ""United States of America""}]",2016-08-02 00:00:00,745000000,123.0,"[{""iso_639_1"": ""en"", ""name"": ""English""}]",Released,Worst Heroes Ever,Suicide Squad,5.9,7458
74,178000000,"[{""id"": 28, ""name"": ""Action""}, {""id"": 878, ""name"": ""Science Fiction""}]",http://www.edgeoftomorrowmovie.com/,137113,"[{""id"": 563, ""name"": ""deja vu""}, {""id"": 1521, ""name"": ""time warp""}, {""id"": 2062, ""name"": ""restart""}, {""id"": 4565, ""name"": ""dystopia""}, {""id"": 6091, ""name"": ""war""}, {""id"": 9951, ""name"": ""alien""}, {""id"": 11109, ""name"": ""military officer""}, {""id"": 13065, ""name"": ""soldier""}, {""id"": 14909, ""name"": ""alien invasion""}, {""id"": 204318, ""name"": ""exoskeleton""}]",en,Edge of Tomorrow,"Major Bill Cage is an officer who has never seen a day of combat when he is unceremoniously demoted and dropped into combat. Cage is killed within minutes, managing to take an alpha alien down with him. He awakens back at the beginning of the same day and is forced to fight and die again... and again - as physical contact with the alien has thrown him into a time loop.",79.456485,"[{""name"": ""Village Roadshow Pictures"", ""id"": 79}, {""name"": ""Warner Bros."", ""id"": 6194}, {""name"": ""Viz Media"", ""id"": 6687}, {""name"": ""Province of British Columbia Production Services Tax Credit"", ""id"": 12200}, {""name"": ""3 Arts Entertainment"", ""id"": 36390}, {""name"": ""RatPac-Dune Entertainment"", ""id"": 41624}]","[{""iso_3166_1"": ""AU"", ""name"": ""Australia""}, {""iso_3166_1"": ""US"", ""name"": ""United States of America""}]",2014-05-27 00:00:00,370541256,113.0,"[{""iso_639_1"": ""en"", ""name"": ""English""}]",Released,"Live, Die, Repeat",Edge of Tomorrow,7.6,4858
77,175000000,"[{""id"": 18, ""name"": ""Drama""}, {""id"": 35, ""name"": ""Comedy""}, {""id"": 16, ""name"": ""Animation""}, {""id"": 10751, ""name"": ""Family""}]",http://movies.disney.com/inside-out,150540,"[{""id"": 1566, ""name"": ""dream""}, {""id"": 6513, ""name"": ""cartoon""}, {""id"": 7942, ""name"": ""imaginary friend""}, {""id"": 10336, ""name"": ""animation""}, {""id"": 18035, ""name"": ""family""}, {""id"": 18253, ""name"": ""moving""}, {""id"": 161155, ""name"": ""kids""}, {""id"": 163227, ""name"": ""unicorn""}, {""id"": 179431, ""name"": ""duringcreditsstinger""}, {""id"": 209714, ""name"": ""3d""}, {""id"": 211269, ""name"": ""emotions""}]",en,Inside Out,"Growing up can be a bumpy road, and it's no exception for Riley, who is uprooted from her Midwest life when her father starts a new job in San Francisco. Like all of us, Riley is guided by her emotions - Joy, Fear, Anger, Disgust and Sadness. The emotions live in Headquarters, the control center inside Riley's mind, where they help advise her through everyday life. As Riley and her emotions struggle to adjust to a new life in San Francisco, turmoil ensues in Headquarters. Although Joy, Riley's main and most important emotion, tries to keep things positive, the emotions conflict on how best to navigate a new city, house and school.",128.65596399999998,"[{""name"": ""Walt Disney Pictures"", ""id"": 2}, {""name"": ""Pixar Animation Studios"", ""id"": 3}]","[{""iso_3166_1"": ""US"", ""name"": ""United States of America""}]",2015-06-09 00:00:00,857611174,94.0,"[{""iso_639_1"": ""en"", ""name"": ""English""}]",Released,Meet the little voices inside your head.,Inside Out,8.0,6560
