,budget,genres,homepage,id,keywords,original_language,original_title,overview,popularity,production_companies,production_countries,release_date,revenue,runtime,spoken_languages,status,tagline,title,vote_average,vote_count
744,60000000,"[{""id"": 12, ""name"": ""Adventure""}, {""id"": 16, ""name"": ""Animation""}, {""id"": 35, ""name"": ""Comedy""}, {""id"": 10751, ""name"": ""Family""}, {""id"": 14, ""name"": ""Fantasy""}]",http://www.thelegomovie.com,137106,"[{""id"": 494, ""name"": ""father son relationship""}, {""id"": 5376, ""name"": ""creativity""}, {""id"": 6054, ""name"": ""friendship""}, {""id"": 9977, ""name"": ""part live action""}, {""id"": 10324, ""name"": ""toys""}, {""id"": 10542, ""name"": ""based on toy""}, {""id"": 13072, ""name"": ""falling in love""}, {""id"": 163455, ""name"": ""super powers""}, {""id"": 179431, ""name"": ""duringcreditsstinger""}, {""id"": 204035, ""name"": ""different worlds""}, {""id"": 210090, ""name"": ""lego""}, {""id"": 230775, ""name"": ""batman""}]",en,The Lego Movie,"An ordinary Lego mini-figure, mistakenly thought to be the extraordinary MasterBuilder, is recruited to join a quest to stop an evil Lego tyrant from gluing the universe together.",59.547928000000006,"[{""name"": ""Village Roadshow Pictures"", ""id"": 79}, {""name"": ""DC Comics"", ""id"": 429}, {""name"": ""Vertigo Entertainment"", ""id"": 829}, {""name"": ""Lin Pictures"", ""id"": 2723}, {""name"": ""Warner Bros. Animation"", ""id"": 2785}, {""name"": ""LEGO"", ""id"": 4081}, {""name"": ""Warner Bros."", ""id"": 6194}, {""name"": ""Animal Logic"", ""id"": 8089}, {""name"": ""Warner Animation Group"", ""id"": 25120}, {""name"": ""RatPac-Dune Entertainment"", ""id"": 41624}]","[{""iso_3166_1"": ""US"", ""name"": ""United States of America""}]",2014-02-06 00:00:00,469160692,100.0,"[{""iso_639_1"": ""en"", ""name"": ""English""}]",Released,The story of a nobody who saved everybody.,The Lego Movie,7.5,3070
776,60000000,"[{""id"": 18, ""name"": ""Drama""}, {""id"": 14, ""name"": ""Fantasy""}, {""id"": 9648, ""name"": ""Mystery""}, {""id"": 10749, ""name"": ""Romance""}]",http://www.winterstalemovie.com/,137321,"[{""id"": 818, ""name"": ""based on novel""}]",en,Winter's Tale,"A burglar falls for an heiress as she dies in his arms. When he learns that he has the gift of reincarnation, he sets out to save her.",22.736038,"[{""name"": ""Village Roadshow Pictures"", ""id"": 79}, {""name"": ""Weed Road Pictures"", ""id"": 433}, {""name"": ""Warner Bros."", ""id"": 6194}]","[{""iso_3166_1"": ""US"", ""name"": ""United States of America""}]",2014-02-13 00:00:00,30800231,118.0,"[{""iso_639_1"": ""en"", ""name"": ""English""}]",Released,This is not a true story. This is true love.,Winter's Tale,6.0,487
783,60000000,"[{""id"": 35, ""name"": ""Comedy""}, {""id"": 12, ""name"": ""Adventure""}]",http://mortdecaithemovie.com/,210860,"[{""id"": 818, ""name"": ""based on novel""}, {""id"": 5918, ""name"": ""painting""}, {""id"": 11061, ""name"": ""debt""}, {""id"": 155795, ""name"": ""art dealer""}, {""id"": 159534, ""name"": ""stolen painting""}]",en,Mortdecai,"Art dealer, Charles Mortdecai, searches for a stolen painting rumored to contain a secret code that gains access to hidden Nazi gold.",52.417528999999995,"[{""name"": ""Lionsgate"", ""id"": 1632}, {""name"": ""Mad Chance"", ""id"": 1757}, {""name"": ""OddLot Entertainment"", ""id"": 36209}, {""name"": ""Huayi Brothers Media"", ""id"": 39649}]","[{""iso_3166_1"": ""US"", ""name"": ""United States of America""}]",2015-01-21 00:00:00,30418560,106.0,"[{""iso_639_1"": ""en"", ""name"": ""English""}]",Released,Sophistication Has a Name.,Mortdecai,5.4,1055
786,68490000,"[{""id"": 28, ""name"": ""Action""}, {""id"": 12, ""name"": ""Adventure""}, {""id"": 14, ""name"": ""Fantasy""}]",http://themonkeykingmovie.com,381902,"[{""id"": 207411, ""name"": ""monkey king""}]",zh,西游记之孙悟空三打白骨精,"Taking place 500 years after the Havoc in Heaven, the Tang Priest is appointed by Buddha to go to the West to fetch the sacred scriptures, only to accidentally free the Monkey King. With Lady White (Gong Li) aiming to break up the team assembled to defeat her, the Monkey King must fight in order to save his world!",4.7262900000000005,"[{""name"": ""Filmko Pictures"", ""id"": 9175}]","[{""iso_3166_1"": ""HK"", ""name"": ""Hong Kong""}, {""iso_3166_1"": ""CN"", ""name"": ""China""}]",2016-01-22 00:00:00,193677158,120.0,"[{""iso_639_1"": ""zh"", ""name"": ""\u666e\u901a\u8bdd""}]",Released,,The Monkey King 2,6.0,24
788,58000000,"[{""id"": 28, ""name"": ""Action""}, {""id"": 12, ""name"": ""Adventure""}, {""id"": 35, ""name"": ""Comedy""}]",http://www.foxmovies.com/movies/deadpool,293660,"[{""id"": 2095, ""name"": ""anti hero""}, {""id"": 3070, ""name"": ""mercenary""}, {""id"": 8828, ""name"": ""marvel comic""}, {""id"": 9715, ""name"": ""superhero""}, {""id"": 9717, ""name"": ""based on comic book""}, {""id"": 11687, ""name"": ""breaking the fourth wall""}, {""id"": 179430, ""name"": ""aftercreditsstinger""}, {""id"": 179431, ""name"": ""duringcreditsstinger""}, {""id"": 223060, ""name"": ""self healing""}]",en,Deadpool,"Deadpool tells the origin story of former Special Forces operative turned mercenary Wade Wilson, who after being subjected to a rogue experiment that leaves him with accelerated healing powers, adopts the alter ego Deadpool. Armed with his new abilities and a dark, twisted sense of humor, Deadpool hunts down the man who nearly destroyed his life.",514.5699559999999,"[{""name"": ""Twentieth Century Fox Film Corporation"", ""id"": 306}, {""name"": ""Marvel Entertainment"", ""id"": 7505}, {""name"": ""The Donners' Company"", ""id"": 11307}, {""name"": ""TSG Entertainment"", ""id"": 22213}, {""name"": ""Kinberg Genre"", ""id"": 78091}]","[{""iso_3166_1"": ""US"", ""name"": ""United States of America""}]",2016-02-09 00:00:00,783112979,108.0,"[{""iso_639_1"": ""en"", ""name"": ""English""}]",Released,Witness the beginning of a happy ending,Deadpool,7.4,10995
790,58800000,"[{""id"": 10752, ""name"": ""War""}, {""id"": 28, ""name"": ""Action""}]",http://www.americansnipermovie.com,190859,"[{""id"": 1589, ""name"": ""sniper""}, {""id"": 5565, ""name"": ""biography""}, {""id"": 5939, ""name"": ""iraq""}, {""id"": 11219, ""name"": ""navy seal""}, {""id"": 33564, ""name"": ""u.s. soldier""}]",en,American Sniper,"U.S. Navy SEAL Chris Kyle takes his sole mission—protect his comrades—to heart and becomes one of the most lethal snipers in American history. His pinpoint accuracy not only saves countless lives but also makes him a prime target of insurgents. Despite grave danger and his struggle to be a good husband and father to his family back in the States, Kyle serves four tours of duty in Iraq. However, when he finally returns home, he finds that he cannot leave the war behind.",87.53437,"[{""name"": ""Village Roadshow Pictures"", ""id"": 79}, {""name"": ""Malpaso Productions"", ""id"": 171}, {""name"": ""Warner Bros."", ""id"": 6194}, {""name"": ""RatPac-Dune Entertainment"", ""id"": 41624}, {""name"": ""Mad Chance Productions"", ""id"": 57408}, {""name"": ""22 & Indiana Pictures"", ""id"": 57409}]","[{""iso_3166_1"": ""US"", ""name"": ""United States of America""}]",2014-12-11 00:00:00,542307423,133.0,"[{""iso_639_1"": ""en"", ""name"": ""English""}]",Released,The most lethal sniper in U.S. history.,American Sniper,7.4,4469
791,58000000,"[{""id"": 12, ""name"": ""Adventure""}, {""id"": 27, ""name"": ""Horror""}, {""id"": 35, ""name"": ""Comedy""}]",http://www.goosebumps-movie.com/,257445,"[{""id"": 818, ""name"": ""based on novel""}, {""id"": 2343, ""name"": ""magic""}, {""id"": 2486, ""name"": ""fantasy""}, {""id"": 12564, ""name"": ""werewolf""}, {""id"": 18035, ""name"": ""family""}, {""id"": 163226, ""name"": ""ventriloquist dummy""}, {""id"": 186948, ""name"": ""book comes to life""}, {""id"": 209714, ""name"": ""3d""}]",en,Goosebumps,"A teenager teams up with the daughter of young adult horror author R.L. Stine after the writer's imaginary demons are set free on the town of Madison, Delaware.",45.351617,"[{""name"": ""Columbia Pictures"", ""id"": 5}, {""name"": ""Village Roadshow Pictures"", ""id"": 79}, {""name"": ""Original Film"", ""id"": 333}, {""name"": ""Sony Pictures Animation"", ""id"": 2251}, {""name"": ""Sony Pictures Entertainment (SPE)"", ""id"": 7431}, {""name"": ""Scholastic Entertainment"", ""id"": 30246}, {""name"": ""LStar Capital"", ""id"": 34034}]","[{""iso_3166_1"": ""AU"", ""name"": ""Australia""}, {""iso_3166_1"": ""US"", ""name"": ""United States of America""}]",2015-08-05 00:00:00,158162788,103.0,"[{""iso_639_1"": ""en"", ""name"": ""English""}]",Released,The stories are alive.,Goosebumps,6.2,995
796,60000000,"[{""id"": 35, ""name"": ""Comedy""}, {""id"": 37, ""name"": ""Western""}]",http://www.netflix.com/title/80039517,347969,"[{""id"": 155573, ""name"": ""wild west""}]",en,The Ridiculous 6,"When his long-lost outlaw father returns, Tommy ""White Knife"" Stockburn goes on an adventure-filled journey across the Old West with his five brothers.",19.694695,"[{""name"": ""Happy Madison Productions"", ""id"": 2608}]","[{""iso_3166_1"": ""US"", ""name"": ""United States of America""}]",2015-12-11 00:00:00,0,119.0,"[{""iso_639_1"": ""en"", ""name"": ""English""}]",Released,,The Ridiculous 6,4.9,388
821,55000000,"[{""id"": 53, ""name"": ""Thriller""}, {""id"": 28, ""name"": ""Action""}, {""id"": 80, ""name"": ""Crime""}]",,156022,"[{""id"": 417, ""name"": ""corruption""}, {""id"": 782, ""name"": ""assassin""}, {""id"": 1562, ""name"": ""hostage""}, {""id"": 1812, ""name"": ""fbi""}, {""id"": 2708, ""name"": ""hitman""}, {""id"": 2808, ""name"": ""russian""}, {""id"": 3016, ""name"": ""security camera""}, {""id"": 4426, ""name"": ""sadism""}, {""id"": 7002, ""name"": ""vigilante""}, {""id"": 9740, ""name"": ""sociopath""}, {""id"": 9748, ""name"": ""revenge""}, {""id"": 9937, ""name"": ""suspense""}, {""id"": 10291, ""name"": ""organized crime""}, {""id"": 10292, ""name"": ""gore""}, {""id"": 13142, ""name"": ""gangster""}, {""id"": 14819, ""name"": ""violence""}, {""id"": 15048, ""name"": ""teenage prostitute""}, {""id"": 15248, ""name"": ""commando""}, {""id"": 15271, ""name"": ""interrogation""}, {""id"": 18420, ""name"": ""surveillance""}, {""id"": 162380, ""name"": ""ex soldier""}, {""id"": 163810, ""name"": ""faked death""}, {""id"": 167104, ""name"": ""loner""}, {""id"": 167164, ""name"": ""call girl""}, {""id"": 175056, ""name"": ""black ops""}, {""id"": 188955, ""name"": ""hand to hand combat""}, {""id"": 209525, ""name"": ""mysterious past""}]",en,The Equalizer,"In The Equalizer, Denzel Washington plays McCall, a man who believes he has put his mysterious past behind him and dedicated himself to beginning a new, quiet life. But when McCall meets Teri (Chloë Grace Moretz), a young girl under the control of ultra-violent Russian gangsters, he can’t stand idly by – he has to help her. Armed with hidden skills that allow him to serve vengeance against anyone who would brutalize the helpless, McCall comes out of his self-imposed retirement and finds his desire for justice reawakened. If someone has a problem, if the odds are stacked against them, if they have nowhere else to turn, McCall will help. He is The Equalizer.",79.92205899999999,"[{""name"": ""Columbia Pictures"", ""id"": 5}, {""name"": ""Village Roadshow Pictures"", ""id"": 79}, {""name"": ""Escape Artists"", ""id"": 1423}, {""name"": ""Mace Neufeld Productions"", ""id"": 2767}, {""name"": ""LStar Capital"", ""id"": 34034}, {""name"": ""Lonetree Entertainment"", ""id"": 41096}]","[{""iso_3166_1"": ""US"", ""name"": ""United States of America""}]",2014-09-24 00:00:00,192330738,132.0,"[{""iso_639_1"": ""en"", ""name"": ""English""}]",Released,What do you see when you look at me?,The Equalizer,7.1,2954
842,55000000,"[{""id"": 10751, ""name"": ""Family""}, {""id"": 35, ""name"": ""Comedy""}]",http://www.paddington.com/,116149,"[{""id"": 392, ""name"": ""england""}, {""id"": 477, ""name"": ""train station""}, {""id"": 818, ""name"": ""based on novel""}, {""id"": 10468, ""name"": ""bear""}, {""id"": 11500, ""name"": ""anthropomorphism""}, {""id"": 167625, ""name"": ""talking to animals""}, {""id"": 170173, ""name"": ""children's book""}]",en,Paddington,"A young Peruvian bear with a passion for all things British travels to London in search of a home. Finding himself lost and alone at Paddington Station, he begins to realize that city life is not all he had imagined - until he meets the kindly Brown family, who read the label around his neck ('Please look after this bear. Thank you.') and offer him a temporary haven. It looks as though his luck has changed until this rarest of bears catches the eye of a museum taxidermist...",39.882276,"[{""name"": ""The Weinstein Company"", ""id"": 308}, {""name"": ""StudioCanal"", ""id"": 694}, {""name"": ""TF1 Films Production"", ""id"": 3823}, {""name"": ""Canal+"", ""id"": 5358}, {""name"": ""Heyday Films"", ""id"": 7364}, {""name"": ""Cin\u00e9+"", ""id"": 10611}, {""name"": ""Anton Capital Entertainment (ACE)"", ""id"": 20664}, {""name"": ""TF1"", ""id"": 22123}, {""name"": ""Amazon Prime Instant Video"", ""id"": 58773}]","[{""iso_3166_1"": ""GB"", ""name"": ""United Kingdom""}]",2014-11-27 00:00:00,259207227,95.0,"[{""iso_639_1"": ""en"", ""name"": ""English""}]",Released,The Adventure Begins,Paddington,7.0,883
858,50000000,"[{""id"": 35, ""name"": ""Comedy""}, {""id"": 12, ""name"": ""Adventure""}, {""id"": 80, ""name"": ""Crime""}, {""id"": 10751, ""name"": ""Family""}]",,145220,"[{""id"": 4344, ""name"": ""musical""}, {""id"": 12998, ""name"": ""the muppets""}]",en,Muppets Most Wanted,"While on a grand world tour, The Muppets find themselves wrapped into an European jewel-heist caper headed by a Kermit the Frog look-alike and his dastardly sidekick.",14.808304000000001,"[{""name"": ""Buena Vista"", ""id"": 32}, {""name"": ""Disney"", ""id"": 6421}]","[{""iso_3166_1"": ""US"", ""name"": ""United States of America""}]",2014-03-20 00:00:00,80383290,112.0,"[{""iso_639_1"": ""de"", ""name"": ""Deutsch""}, {""iso_639_1"": ""en"", ""name"": ""English""}]",Released,Taking the world by farce,Muppets Most Wanted,6.2,316
877,53000000,"[{""id"": 80, ""name"": ""Crime""}, {""id"": 18, ""name"": ""Drama""}]",,261023,"[{""id"": 1680, ""name"": ""boston""}, {""id"": 9672, ""name"": ""based on true story""}, {""id"": 10291, ""name"": ""organized crime""}]",en,Black Mass,"The true story of Whitey Bulger, the brother of a state senator and the most infamous violent criminal in the history of South Boston, who became an FBI informant to take down a Mafia family invading his turf.",46.049902,"[{""name"": ""Infinitum Nihil"", ""id"": 2691}, {""name"": ""Head Gear Films"", ""id"": 5056}, {""name"": ""Cross Creek Pictures"", ""id"": 10246}, {""name"": ""Free State Pictures"", ""id"": 40106}, {""name"": ""RatPac-Dune Entertainment"", ""id"": 41624}, {""name"": ""Le Grisbi Productions"", ""id"": 47169}, {""name"": ""Vendian Entertainment"", ""id"": 50481}]","[{""iso_3166_1"": ""GB"", ""name"": ""United Kingdom""}, {""iso_3166_1"": ""US"", ""name"": ""United States of America""}]",2015-09-04 00:00:00,98837872,122.0,"[{""iso_639_1"": ""en"", ""name"": ""English""}]",Released,Keep your enemies close.,Black Mass,6.3,1242
911,50000000,"[{""id"": 80, ""name"": ""Crime""}, {""id"": 35, ""name"": ""Comedy""}, {""id"": 28, ""name"": ""Action""}]",http://www.22jumpstreetmovie.com,187017,"[{""id"": 6270, ""name"": ""high school""}, {""id"": 11199, ""name"": ""undercover cop""}, {""id"": 167541, ""name"": ""buddy comedy""}, {""id"": 179430, ""name"": ""aftercreditsstinger""}, {""id"": 179431, ""name"": ""duringcreditsstinger""}]",en,22 Jump Street,"After making their way through high school (twice), big changes are in store for officers Schmidt and Jenko when they go deep undercover at a local college. But when Jenko meets a kindred spirit on the football team, and Schmidt infiltrates the bohemian art major scene, they begin to question their partnership. Now they don't have to just crack the case - they have to figure out if they can have a mature relationship. If these two overgrown adolescents can grow from freshmen into real men, college might be the best thing that ever happened to them.",52.380982,"[{""name"": ""Columbia Pictures"", ""id"": 5}, {""name"": ""Original Film"", ""id"": 333}, {""name"": ""Media Rights Capital"", ""id"": 2531}, {""name"": ""Metro-Goldwyn-Mayer (MGM)"", ""id"": 8411}, {""name"": ""Cannell Studios"", ""id"": 9194}, {""name"": ""LStar Capital"", ""id"": 34034}, {""name"": ""33andOut Productions"", ""id"": 34035}, {""name"": ""JHF Productions"", ""id"": 34036}]","[{""iso_3166_1"": ""US"", ""name"": ""United States of America""}]",2014-06-05 00:00:00,188441614,112.0,"[{""iso_639_1"": ""en"", ""name"": ""English""}]",Released,They're not 21 anymore,22 Jump Street,7.0,3319
914,50000000,"[{""id"": 28, ""name"": ""Action""}, {""id"": 35, ""name"": ""Comedy""}]",http://www.centralintelligencemovie.com/,302699,"[{""id"": 470, ""name"": ""spy""}, {""id"": 591, ""name"": ""cia""}, {""id"": 11134, ""name"": ""espionage""}, {""id"": 161213, ""name"": ""high school reunion""}, {""id"": 173367, ""name"": ""reference to facebook""}, {""id"": 207697, ""name"": ""accountant""}]",en,Central Intelligence,"After he reunites with an old pal through Facebook, a mild-mannered accountant is lured into the world of international espionage.",45.318703,"[{""name"": ""New Line Cinema"", ""id"": 12}, {""name"": ""Universal Pictures"", ""id"": 33}, {""name"": ""Bluegrass Films"", ""id"": 13778}, {""name"": ""Principato-Young Entertainment"", ""id"": 37845}]","[{""iso_3166_1"": ""US"", ""name"": ""United States of America""}]",2016-06-15 00:00:00,216972543,107.0,"[{""iso_639_1"": ""en"", ""name"": ""English""}]",Released,Saving the world takes a little Hart and a big Johnson,Central Intelligence,6.2,1650
916,50000000,"[{""id"": 35, ""name"": ""Comedy""}]",http://daddyshomemovie.tumblr.com/,274167,"[{""id"": 230024, ""name"": ""daddys home""}]",en,Daddy's Home,"The story of a mild-mannered radio executive (Ferrell) who strives to become the best stepdad ever to his wife's two children, but complications ensue when their freewheeling, freeloading real father arrives, forcing stepdad to compete for the affection of the kids.",38.616744,"[{""name"": ""Paramount Pictures"", ""id"": 4}, {""name"": ""Gary Sanchez Productions"", ""id"": 4740}, {""name"": ""Red Granite Pictures"", ""id"": 19177}]","[{""iso_3166_1"": ""US"", ""name"": ""United States of America""}]",2015-12-25 00:00:00,242786137,96.0,"[{""iso_639_1"": ""en"", ""name"": ""English""}]",Released,Choose your Daddy,Daddy's Home,5.8,854
917,50000000,"[{""id"": 14, ""name"": ""Fantasy""}, {""id"": 35, ""name"": ""Comedy""}, {""id"": 10402, ""name"": ""Music""}]",http://movies.disney.com/into-the-woods/,224141,"[{""id"": 616, ""name"": ""witch""}, {""id"": 995, ""name"": ""cinderella""}, {""id"": 3071, ""name"": ""prince""}, {""id"": 3205, ""name"": ""fairy tale""}, {""id"": 4344, ""name"": ""musical""}, {""id"": 7376, ""name"": ""princess""}, {""id"": 10449, ""name"": ""sondheim""}, {""id"": 10541, ""name"": ""curse""}, {""id"": 158375, ""name"": ""based on stage musical""}, {""id"": 166472, ""name"": ""beanstalk""}, {""id"": 179431, ""name"": ""duringcreditsstinger""}, {""id"": 192993, ""name"": ""red riding hood""}]",en,Into the Woods,"In a woods filled with magic and fairy tale characters, a baker and his wife set out to end the curse put on them by their neighbor, a spiteful witch.",65.90160999999999,"[{""name"": ""Walt Disney Pictures"", ""id"": 2}, {""name"": ""Marc Platt Productions"", ""id"": 2527}, {""name"": ""Lucamar Productions"", ""id"": 17021}]","[{""iso_3166_1"": ""US"", ""name"": ""United States of America""}]",2014-12-25 00:00:00,212902372,125.0,"[{""iso_639_1"": ""en"", ""name"": ""English""}]",Released,Be careful what you wish for...,Into the Woods,5.6,1652
930,50000000,"[{""id"": 28, ""name"": ""Action""}, {""id"": 53, ""name"": ""Thriller""}, {""id"": 9648, ""name"": ""Mystery""}]",,225574,"[{""id"": 3800, ""name"": ""airplane""}, {""id"": 10410, ""name"": ""conspiracy""}, {""id"": 12617, ""name"": ""airplane crash""}, {""id"": 15156, ""name"": ""cell phone""}, {""id"": 155238, ""name"": ""hijack""}, {""id"": 162914, ""name"": ""one night""}, {""id"": 184297, ""name"": ""mystery killer""}]",en,Non-Stop,"Bill Marks is a burned-out veteran of the Air Marshals service. He views the assignment not as a life-saving duty, but as a desk job in the sky. However, today's flight will be no routine trip. Shortly into the transatlantic journey from New York to London, he receives a series of mysterious text messages ordering him to have the government transfer $150 million into a secret account, or a passenger will die every 20 minutes.",83.295796,"[{""name"": ""StudioCanal"", ""id"": 694}, {""name"": ""Silver Pictures"", ""id"": 1885}, {""name"": ""TF1 Films Production"", ""id"": 3823}, {""name"": ""Canal+"", ""id"": 5358}, {""name"": ""Anton Capital Entertainment (ACE)"", ""id"": 20664}, {""name"": ""TF1"", ""id"": 22123}, {""name"": ""LOVEFiLM International"", ""id"": 26387}]","[{""iso_3166_1"": ""FR"", ""name"": ""France""}, {""iso_3166_1"": ""GB"", ""name"": ""United Kingdom""}, {""iso_3166_1"": ""US"", ""name"": ""United States of America""}]",2014-01-26 00:00:00,222809600,106.0,"[{""iso_639_1"": ""en"", ""name"": ""English""}, {""iso_639_1"": ""de"", ""name"": ""Deutsch""}]",Released,The hijacking was just the beginning.,Non-Stop,6.8,2268
941,50000000,"[{""id"": 28, ""name"": ""Action""}, {""id"": 18, ""name"": ""Drama""}, {""id"": 36, ""name"": ""History""}, {""id"": 53, ""name"": ""Thriller""}, {""id"": 10752, ""name"": ""War""}]",http://www.thirteenhoursmovie.com/,300671,"[{""id"": 818, ""name"": ""based on novel""}, {""id"": 1376, ""name"": ""assault rifle""}, {""id"": 3070, ""name"": ""mercenary""}, {""id"": 5272, ""name"": ""libya""}, {""id"": 5565, ""name"": ""biography""}, {""id"": 9672, ""name"": ""based on true story""}, {""id"": 11115, ""name"": ""heroism""}, {""id"": 14601, ""name"": ""explosion""}, {""id"": 34061, ""name"": ""american abroad""}, {""id"": 34079, ""name"": ""death""}, {""id"": 209493, ""name"": ""21st century""}, {""id"": 214596, ""name"": ""cia agent""}, {""id"": 235476, ""name"": ""u.s. ambassador""}]",en,13 Hours: The Secret Soldiers of Benghazi,An American Ambassador is killed during an attack at a U.S. compound in Libya as a security team struggles to make sense out of the chaos.,42.526529,"[{""name"": ""Paramount Pictures"", ""id"": 4}, {""name"": ""3 Arts Entertainment"", ""id"": 787}, {""name"": ""Bay Films"", ""id"": 6734}, {""name"": ""Latina Pictures"", ""id"": 19108}, {""name"": ""Dune Films"", ""id"": 19477}]","[{""iso_3166_1"": ""MT"", ""name"": ""Malta""}, {""iso_3166_1"": ""MA"", ""name"": ""Morocco""}, {""iso_3166_1"": ""US"", ""name"": ""United States of America""}]",2016-01-13 00:00:00,69411370,144.0,"[{""iso_639_1"": ""ar"", ""name"": ""\u0627\u0644\u0639\u0631\u0628\u064a\u0629""}, {""iso_639_1"": ""en"", ""name"": ""English""}]",Released,"When everything went wrong, six men had the courage to do what was right.",13 Hours: The Secret Soldiers of Benghazi,7.0,938
942,50000000,"[{""id"": 10749, ""name"": ""Romance""}, {""id"": 16, ""name"": ""Animation""}, {""id"": 12, ""name"": ""Adventure""}, {""id"": 35, ""name"": ""Comedy""}, {""id"": 10751, ""name"": ""Family""}, {""id"": 14, ""name"": ""Fantasy""}]",http://www.bookoflifemovie.com/,228326,"[{""id"": 128, ""name"": ""love triangle""}, {""id"": 6155, ""name"": ""afterlife""}, {""id"": 209789, ""name"": ""day of the dead""}, {""id"": 209790, ""name"": ""bullfighting""}]",en,The Book of Life,"The journey of Manolo, a young man who is torn between fulfilling the expectations of his family and following his heart. Before choosing which path to follow, he embarks on an incredible adventure that spans three fantastical worlds where he must face his greatest fears.",34.890999,"[{""name"": ""Twentieth Century Fox Film Corporation"", ""id"": 306}, {""name"": ""Reel FX Creative Studios"", ""id"": 2787}, {""name"": ""Twentieth Century Fox Animation"", ""id"": 11749}, {""name"": ""Chatrone"", ""id"": 79031}]","[{""iso_3166_1"": ""MX"", ""name"": ""Mexico""}, {""iso_3166_1"": ""US"", ""name"": ""United States of America""}]",2014-10-01 00:00:00,97437106,95.0,"[{""iso_639_1"": ""en"", ""name"": ""English""}]",Released,,The Book of Life,7.3,755
951,50000000,"[{""id"": 28, ""name"": ""Action""}, {""id"": 53, ""name"": ""Thriller""}]",,216282,"[{""id"": 2213, ""name"": ""tornado""}, {""id"": 12105, ""name"": ""student""}, {""id"": 163053, ""name"": ""found footage""}, {""id"": 199076, ""name"": ""disaster movie""}]",en,Into the Storm,"The town of Silverton is in one day destroyed by the unprecedented power of a series of tornadoes. The population is at the mercy of the unpredictable and deadly cyclones, while hunters warn that the worst is yet to come. Most people find shelter, but some just go to the tornado for that one, unique shot.",20.566554,"[{""name"": ""New Line Cinema"", ""id"": 12}, {""name"": ""Village Roadshow Pictures"", ""id"": 79}, {""name"": ""Broken Road Productions"", ""id"": 8000}, {""name"": ""RatPac-Dune Entertainment"", ""id"": 41624}]","[{""iso_3166_1"": ""US"", ""name"": ""United States of America""}]",2014-08-06 00:00:00,160602194,89.0,"[{""iso_639_1"": ""en"", ""name"": ""English""}]",Released,Prepare to go,Into the Storm,5.8,817
