,budget,genres,homepage,id,keywords,original_language,original_title,overview,popularity,production_companies,production_countries,release_date,revenue,runtime,spoken_languages,status,tagline,title,vote_average,vote_count
2225,20000000,"[{""id"": 35, ""name"": ""Comedy""}, {""id"": 10749, ""name"": ""Romance""}, {""id"": 80, ""name"": ""Crime""}, {""id"": 18, ""name"": ""Drama""}, {""id"": 9648, ""name"": ""Mystery""}]",http://inherentvicemovie.com/,171274,"[{""id"": 818, ""name"": ""based on novel""}, {""id"": 1228, ""name"": ""1970s""}, {""id"": 11168, ""name"": ""private investigator""}, {""id"": 11492, ""name"": ""smoking marijuana""}, {""id"": 12670, ""name"": ""los angeles""}, {""id"": 208992, ""name"": ""1960s""}]",en,Inherent Vice,"In Los Angeles at the turn of the 1970s, drug-fueled detective Larry ""Doc"" Sportello investigates the disappearance of an ex-girlfriend.",45.742217,"[{""name"": ""Ghoulardi Film Company"", ""id"": 178}, {""name"": ""Warner Bros."", ""id"": 6194}, {""name"": ""IAC Films"", ""id"": 93105}]","[{""iso_3166_1"": ""US"", ""name"": ""United States of America""}]",2014-12-25 00:00:00,11110975,148.0,"[{""iso_639_1"": ""en"", ""name"": ""English""}]",Released,"Under the paving stones, the beach!",Inherent Vice,6.5,833
2233,20000000,"[{""id"": 35, ""name"": ""Comedy""}, {""id"": 18, ""name"": ""Drama""}, {""id"": 10752, ""name"": ""War""}]",http://www.littleboymovie.com/,256962,"[{""id"": 907, ""name"": ""japanese""}, {""id"": 1956, ""name"": ""world war ii""}, {""id"": 10706, ""name"": ""spirituality""}]",en,Little Boy,An eight-year-old boy is willing to do whatever it takes to end World War II so he can bring his father home. The story reveals the indescribable love a father has for his little boy and the love a son has for his father.,12.232047999999999,"[{""name"": ""Metanoia Films"", ""id"": 7075}, {""name"": ""Santa F\u00e9 Films"", ""id"": 90508}]","[{""iso_3166_1"": ""MX"", ""name"": ""Mexico""}, {""iso_3166_1"": ""US"", ""name"": ""United States of America""}]",2015-04-23 00:00:00,6420319,106.0,"[{""iso_639_1"": ""en"", ""name"": ""English""}]",Released,Believe the impossible.,Little Boy,7.0,185
2240,20000000,"[{""id"": 80, ""name"": ""Crime""}, {""id"": 18, ""name"": ""Drama""}, {""id"": 53, ""name"": ""Thriller""}]",http://amostviolentyear.com/,241239,"[{""id"": 417, ""name"": ""corruption""}, {""id"": 592, ""name"": ""capitalism""}, {""id"": 1442, ""name"": ""winter""}, {""id"": 2355, ""name"": ""american dream""}, {""id"": 2356, ""name"": ""immigrant""}, {""id"": 7337, ""name"": ""business ethics""}, {""id"": 9276, ""name"": ""truck""}, {""id"": 10590, ""name"": ""oil""}, {""id"": 10909, ""name"": ""lawyer""}, {""id"": 14512, ""name"": ""new york city""}, {""id"": 166631, ""name"": ""loan shark""}, {""id"": 168948, ""name"": ""coat""}, {""id"": 189102, ""name"": ""tunnel""}, {""id"": 208289, ""name"": ""1980s""}, {""id"": 235729, ""name"": ""husband wife relationship""}, {""id"": 238182, ""name"": ""truck hijacking""}, {""id"": 238183, ""name"": ""bank loan""}]",en,A Most Violent Year,"A thriller set in New York City during the winter of 1981, statistically one of the most violent years in the city's history, and centered on a the lives of an immigrant and his family trying to expand their business and capitalize on opportunities as the rampant violence, decay, and corruption of the day drag them in and threaten to destroy all they have built.",37.629309,"[{""name"": ""Participant Media"", ""id"": 6735}, {""name"": ""Imagenation Abu Dhabi FZ"", ""id"": 6736}, {""name"": ""FilmNation Entertainment"", ""id"": 7493}, {""name"": ""Before the Door Pictures"", ""id"": 14861}, {""name"": ""Washington Square Films"", ""id"": 14862}, {""name"": ""A24"", ""id"": 41077}, {""name"": ""Old Bull Pictures"", ""id"": 53656}]","[{""iso_3166_1"": ""AE"", ""name"": ""United Arab Emirates""}, {""iso_3166_1"": ""US"", ""name"": ""United States of America""}]",2014-12-30 00:00:00,12007070,125.0,"[{""iso_639_1"": ""es"", ""name"": ""Espa\u00f1ol""}, {""iso_639_1"": ""en"", ""name"": ""English""}]",Released,The result is never in question. Just the path you take to get there.,A Most Violent Year,6.5,546
2251,20000000,"[{""id"": 18, ""name"": ""Drama""}]",http://www.myallamerican.com/,334531,"[{""id"": 579, ""name"": ""american football""}, {""id"": 5565, ""name"": ""biography""}, {""id"": 6075, ""name"": ""sport""}, {""id"": 169071, ""name"": ""championship""}]",en,My All American,"Freddie Steinmark, an underdog on the gridiron, faces the toughest challenge of his life after leading his team to a championship season.",3.1029869999999997,"[{""name"": ""Paul Schiff Productions"", ""id"": 23596}, {""name"": ""Anthem Productions"", ""id"": 50496}]","[{""iso_3166_1"": ""US"", ""name"": ""United States of America""}]",2015-11-13 00:00:00,0,118.0,"[{""iso_639_1"": ""en"", ""name"": ""English""}]",Released,Hope never quits,My All American,6.8,36
2257,10000000,"[{""id"": 18, ""name"": ""Drama""}, {""id"": 10749, ""name"": ""Romance""}]",,314385,"[{""id"": 254, ""name"": ""france""}, {""id"": 612, ""name"": ""hotel""}, {""id"": 1228, ""name"": ""1970s""}, {""id"": 9872, ""name"": ""grief""}, {""id"": 9935, ""name"": ""travel""}, {""id"": 156455, ""name"": ""unhappiness""}, {""id"": 166113, ""name"": ""marriage problems""}, {""id"": 187056, ""name"": ""woman director""}]",en,By the Sea,"Set in France during the mid-1970s, Vanessa, a former dancer, and her husband Roland, an American writer, travel the country together. They seem to be growing apart, but when they linger in one quiet, seaside town they begin to draw close to some of its more vibrant inhabitants, such as a local bar/café-keeper and a hotel owner.",11.267676,"[{""name"": ""Plan B Entertainment"", ""id"": 81}, {""name"": ""Jolie Pas"", ""id"": 39443}, {""name"": ""Pellikola"", ""id"": 73249}]","[{""iso_3166_1"": ""FR"", ""name"": ""France""}, {""iso_3166_1"": ""US"", ""name"": ""United States of America""}]",2015-11-12 00:00:00,3727746,122.0,"[{""iso_639_1"": ""uk"", ""name"": ""\u0423\u043a\u0440\u0430\u0457\u043d\u0441\u044c\u043a\u0438\u0439""}, {""iso_639_1"": ""en"", ""name"": ""English""}, {""iso_639_1"": ""fr"", ""name"": ""Fran\u00e7ais""}]",Released,,By the Sea,5.4,156
2267,0,"[{""id"": 27, ""name"": ""Horror""}, {""id"": 9648, ""name"": ""Mystery""}, {""id"": 53, ""name"": ""Thriller""}]",,241257,"[{""id"": 5340, ""name"": ""investigation""}, {""id"": 11469, ""name"": ""memory loss""}]",en,Regression,"Minnesota, 1990. Detective Bruce Kenner investigates the case of young Angela, who accuses her father, John Gray, of an unspeakable crime. When John unexpectedly and without recollection admits guilt, renowned psychologist Dr. Raines is brought in to help him relive his memories and what they discover unmasks a horrifying nationwide mystery.",27.215666,"[{""name"": ""The Weinstein Company"", ""id"": 308}, {""name"": ""Himen\u00f3ptero"", ""id"": 784}, {""name"": ""First Generation Films"", ""id"": 4908}, {""name"": ""Mod Producciones"", ""id"": 5444}, {""name"": ""FilmNation Entertainment"", ""id"": 7493}, {""name"": ""Telef\u00f3nica Studios"", ""id"": 29564}]","[{""iso_3166_1"": ""CA"", ""name"": ""Canada""}, {""iso_3166_1"": ""ES"", ""name"": ""Spain""}]",2015-10-01 00:00:00,17671101,106.0,"[{""iso_639_1"": ""en"", ""name"": ""English""}]",Released,Fear always finds its victim,Regression,5.3,585
2271,0,"[{""id"": 18, ""name"": ""Drama""}, {""id"": 36, ""name"": ""History""}]",,280871,"[{""id"": 2303, ""name"": ""mathematician""}, {""id"": 5565, ""name"": ""biography""}, {""id"": 228041, ""name"": ""prodigy""}, {""id"": 230112, ""name"": ""ramanujam""}, {""id"": 230113, ""name"": ""math genius""}]",ta,ராமானுஜன்,A prodigious Indian mathematician has to overcome poverty and prejudices and make a mark with the help of his British mentor.,0.416179,"[{""name"": ""Camphor Cinema"", ""id"": 82667}]","[{""iso_3166_1"": ""IN"", ""name"": ""India""}]",2014-07-11 00:00:00,0,170.0,"[{""iso_639_1"": ""ta"", ""name"": ""\u0ba4\u0bae\u0bbf\u0bb4\u0bcd""}]",Released,,Ramanujan,5.0,3
2272,0,"[{""id"": 16, ""name"": ""Animation""}]",http://www.dwegons.com/,239897,[],en,Dwegons,"Family inherits an old house and to their surprise, finds the home filled with wonderful colorful creatures that brings the family together.",0.48540500000000003,[],"[{""iso_3166_1"": ""US"", ""name"": ""United States of America""}]",2014-01-24 00:00:00,0,98.0,"[{""iso_639_1"": ""en"", ""name"": ""English""}]",Released,,Dwegons,0.5,1
2273,20000000,"[{""id"": 18, ""name"": ""Drama""}]",,184341,[],en,Hands of Stone,The legendary Roberto Duran and his equally legendary trainer Ray Arcel change each other's lives.,7.444189,"[{""name"": ""Weinstein Company, The"", ""id"": 7289}, {""name"": ""La Piedra Films"", ""id"": 52064}, {""name"": ""Fuego Films"", ""id"": 52065}, {""name"": ""Epicentral Studios"", ""id"": 52066}]","[{""iso_3166_1"": ""PA"", ""name"": ""Panama""}, {""iso_3166_1"": ""US"", ""name"": ""United States of America""}]",2016-08-26 00:00:00,0,105.0,"[{""iso_639_1"": ""en"", ""name"": ""English""}, {""iso_639_1"": ""es"", ""name"": ""Espa\u00f1ol""}]",Released,No más. No surrender.,Hands of Stone,6.1,109
2274,20000000,"[{""id"": 53, ""name"": ""Thriller""}]",http://survivormovie.com/,334074,"[{""id"": 613, ""name"": ""new year's eve""}, {""id"": 657, ""name"": ""fire""}, {""id"": 797, ""name"": ""showdown""}, {""id"": 949, ""name"": ""terrorist""}, {""id"": 4123, ""name"": ""embassy""}, {""id"": 4709, ""name"": ""hand grenade""}, {""id"": 9276, ""name"": ""truck""}, {""id"": 10124, ""name"": ""laboratory""}, {""id"": 10562, ""name"": ""on the run""}, {""id"": 13014, ""name"": ""orphan""}, {""id"": 34079, ""name"": ""death""}, {""id"": 159841, ""name"": ""cigarette lighter""}, {""id"": 175023, ""name"": ""microscope""}, {""id"": 215163, ""name"": ""hazmat suit""}]",en,Survivor,"A Foreign Service Officer in London tries to prevent a terrorist attack set to hit New York, but is forced to go on the run when she is framed for crimes she did not commit.",33.625477000000004,"[{""name"": ""Nu Image Films"", ""id"": 925}, {""name"": ""Winkler Films"", ""id"": 8880}, {""name"": ""Millennium Films"", ""id"": 10254}, {""name"": ""Survivor Productions"", ""id"": 54409}]","[{""iso_3166_1"": ""GB"", ""name"": ""United Kingdom""}, {""iso_3166_1"": ""US"", ""name"": ""United States of America""}]",2015-05-21 00:00:00,0,96.0,"[{""iso_639_1"": ""en"", ""name"": ""English""}]",Released,His Next Target is Now Hunting Him,Survivor,5.4,404
2288,27000000,"[{""id"": 28, ""name"": ""Action""}, {""id"": 18, ""name"": ""Drama""}]",http://www.fightvalley.com/,385383,"[{""id"": 586, ""name"": ""new jersey""}, {""id"": 779, ""name"": ""martial arts""}, {""id"": 5923, ""name"": ""sister""}, {""id"": 6075, ""name"": ""sport""}, {""id"": 9826, ""name"": ""murder""}, {""id"": 9917, ""name"": ""mixed martial arts""}, {""id"": 15108, ""name"": ""justice""}, {""id"": 17977, ""name"": ""underground fighting""}, {""id"": 33610, ""name"": ""gym""}, {""id"": 205851, ""name"": ""ultimate fighting championship""}]",en,Fight Valley,"When Tory Coro turns up dead, the neighborhood turns up silent. Rumor has it she became yet another victim of the small town known as FIGHT VALLEY. Tory's sister Windsor moves to town to begin her own investigation on her sister's mysterious death after weeks of no leads from the police. She's quick to learn that Tory fought for money to make ends meet. If girl-next-door Windsor is going to make her way into FIGHT VALLEY to find the truth about Tory, she's going to have to fight her way in. ""Jabs"" (Miesha Tate) swore she would never throw a punch in the Valley again. Jabs now finds herself training Windsor to survive the painful, unexpected path she's about to take. Every corner. Every alley. Every doorway. She must follow the last footsteps of her sister in order to come face-to-face with Tory's killer in FIGHT VALLEY.",1.224105,"[{""name"": ""Cinestyle Media Group"", ""id"": 74413}]","[{""iso_3166_1"": ""US"", ""name"": ""United States of America""}]",2016-07-22 00:00:00,0,90.0,"[{""iso_639_1"": ""pt"", ""name"": ""Portugu\u00eas""}, {""iso_639_1"": ""en"", ""name"": ""English""}]",Released,One way in. No way out.,Fight Valley,3.9,8
2305,0,"[{""id"": 18, ""name"": ""Drama""}]",,340611,"[{""id"": 818, ""name"": ""based on novel""}, {""id"": 2315, ""name"": ""jewish life""}, {""id"": 2494, ""name"": ""ohio""}, {""id"": 208611, ""name"": ""1950s""}]",en,Indignation,"In 1951, Marcus Messner, a working-class Jewish student from New Jersey, attends a small Ohio college, where he struggles with anti-Semitism, sexual repression, and the ongoing Korean War.",5.625989,"[{""name"": ""Likely Story"", ""id"": 1785}]","[{""iso_3166_1"": ""US"", ""name"": ""United States of America""}]",2016-07-29 00:00:00,0,110.0,"[{""iso_639_1"": ""en"", ""name"": ""English""}]",Released,Based on the novel by Philip Roth.,Indignation,6.8,69
2312,18000000,"[{""id"": 35, ""name"": ""Comedy""}]",,195589,"[{""id"": 567, ""name"": ""alcohol""}, {""id"": 1009, ""name"": ""baby""}, {""id"": 8508, ""name"": ""party""}, {""id"": 18035, ""name"": ""family""}, {""id"": 157632, ""name"": ""fraternity""}, {""id"": 171400, ""name"": ""fraternity house""}, {""id"": 183896, ""name"": ""neighbor neighbor relationship""}, {""id"": 193674, ""name"": ""bathroom humor""}]",en,Neighbors,A couple with a newborn baby face unexpected difficulties after they are forced to live next to a fraternity house.,36.471231,"[{""name"": ""Universal Pictures"", ""id"": 33}, {""name"": ""Point Grey Pictures"", ""id"": 16615}, {""name"": ""Good Universe"", ""id"": 17393}]","[{""iso_3166_1"": ""US"", ""name"": ""United States of America""}]",2014-05-08 00:00:00,268157400,96.0,"[{""iso_639_1"": ""en"", ""name"": ""English""}]",Released,Family vs. Frat,Neighbors,6.2,2713
2320,16000000,"[{""id"": 53, ""name"": ""Thriller""}, {""id"": 28, ""name"": ""Action""}, {""id"": 878, ""name"": ""Science Fiction""}]",http://www.leftbehindmovie.com/,218043,"[{""id"": 3800, ""name"": ""airplane""}, {""id"": 6548, ""name"": ""the rapture""}, {""id"": 9714, ""name"": ""remake""}, {""id"": 175103, ""name"": ""pilot hero""}]",en,Left Behind,A small group of survivors are left behind after millions of people suddenly vanish during the rapture and the world is plunged into chaos and destruction.,33.452469,"[{""name"": ""Stoney Lake Entertainment"", ""id"": 16558}]","[{""iso_3166_1"": ""US"", ""name"": ""United States of America""}]",2014-10-03 00:00:00,19682924,110.0,"[{""iso_639_1"": ""en"", ""name"": ""English""}]",Released,The End Begins,Left Behind,3.7,392
2325,18000000,"[{""id"": 10749, ""name"": ""Romance""}, {""id"": 35, ""name"": ""Comedy""}, {""id"": 10751, ""name"": ""Family""}]",,302688,"[{""id"": 10267, ""name"": ""comedy""}, {""id"": 13027, ""name"": ""wedding""}]",en,My Big Fat Greek Wedding 2,"The continuing adventures of the Portokalos family. A follow-up to the 2002 comedy, ""My Big Fat Greek Wedding.""",16.027955,"[{""name"": ""Universal Pictures"", ""id"": 33}, {""name"": ""Playtone"", ""id"": 4171}, {""name"": ""HBO Films"", ""id"": 7429}, {""name"": ""Gold Circle Films"", ""id"": 12026}]","[{""iso_3166_1"": ""CA"", ""name"": ""Canada""}, {""iso_3166_1"": ""US"", ""name"": ""United States of America""}]",2016-03-23 00:00:00,88923251,94.0,"[{""iso_639_1"": ""en"", ""name"": ""English""}]",Released,People change. Greeks don't.,My Big Fat Greek Wedding 2,5.5,322
2334,18000000,"[{""id"": 18, ""name"": ""Drama""}, {""id"": 35, ""name"": ""Comedy""}]",,194662,"[{""id"": 8764, ""name"": ""times square""}, {""id"": 9715, ""name"": ""superhero""}, {""id"": 11440, ""name"": ""long take""}, {""id"": 14512, ""name"": ""new york city""}, {""id"": 14531, ""name"": ""play""}, {""id"": 156028, ""name"": ""broadway""}, {""id"": 207716, ""name"": ""actor""}]",en,Birdman,"A fading actor best known for his portrayal of a popular superhero attempts to mount a comeback by appearing in a Broadway play. As opening night approaches, his attempts to become more altruistic, rebuild his career, and reconnect with friends and family prove more difficult than expected.",89.811154,"[{""name"": ""Worldview Entertainment"", ""id"": 9015}, {""name"": ""New Regency Pictures"", ""id"": 10104}, {""name"": ""TSG Entertainment"", ""id"": 22213}, {""name"": ""Le Grisbi Productions"", ""id"": 47169}, {""name"": ""M Productions"", ""id"": 52660}]","[{""iso_3166_1"": ""US"", ""name"": ""United States of America""}]",2014-08-27 00:00:00,103215094,119.0,"[{""iso_639_1"": ""en"", ""name"": ""English""}]",Released,or (The Unexpected Virtue of Ignorance),Birdman,7.4,4535
2351,17000000,"[{""id"": 35, ""name"": ""Comedy""}, {""id"": 10751, ""name"": ""Family""}]",http://www.cbsfilms.com/love-the-coopers/,333348,"[{""id"": 4498, ""name"": ""big family""}, {""id"": 10235, ""name"": ""family relationships""}, {""id"": 18035, ""name"": ""family""}, {""id"": 187056, ""name"": ""woman director""}, {""id"": 207317, ""name"": ""christmas""}]",en,Love the Coopers,"When four generations of the Cooper clan come together for their annual Christmas Eve celebration, a series of unexpected visitors and unlikely events turn the night upside down, leading them all toward a surprising rediscovery of family bonds and the spirit of the holiday.",9.191187,"[{""name"": ""Imagine Entertainment"", ""id"": 23}, {""name"": ""Groundswell Productions"", ""id"": 4205}, {""name"": ""CBS Films"", ""id"": 5490}]","[{""iso_3166_1"": ""US"", ""name"": ""United States of America""}]",2015-11-12 00:00:00,24000000,107.0,"[{""iso_639_1"": ""en"", ""name"": ""English""}]",Released,"Christmas means comfort, joy and chaos.",Love the Coopers,5.4,167
2354,30000000,"[{""id"": 18, ""name"": ""Drama""}, {""id"": 36, ""name"": ""History""}]",http://www.stevejobsthefilm.com,321697,"[{""id"": 5565, ""name"": ""biography""}, {""id"": 6104, ""name"": ""computer""}, {""id"": 15300, ""name"": ""father daughter relationship""}, {""id"": 157935, ""name"": ""apple computer""}, {""id"": 161160, ""name"": ""steve jobs""}, {""id"": 185722, ""name"": ""based on true events""}]",en,Steve Jobs,"Set backstage at three iconic product launches and ending in 1998 with the unveiling of the iMac, Steve Jobs takes us behind the scenes of the digital revolution to paint an intimate portrait of the brilliant man at its epicenter.",53.670525,"[{""name"": ""Universal Pictures"", ""id"": 33}, {""name"": ""Scott Rudin Productions"", ""id"": 258}, {""name"": ""Legendary Pictures"", ""id"": 923}, {""name"": ""The Mark Gordon Company"", ""id"": 1557}, {""name"": ""Management 360"", ""id"": 4220}, {""name"": ""Cloud Eight Films"", ""id"": 6708}]","[{""iso_3166_1"": ""US"", ""name"": ""United States of America""}]",2015-10-09 00:00:00,34441873,122.0,"[{""iso_639_1"": ""en"", ""name"": ""English""}]",Released,Can a great man be a good man?,Steve Jobs,6.8,1573
2362,18000000,"[{""id"": 35, ""name"": ""Comedy""}, {""id"": 18, ""name"": ""Drama""}, {""id"": 10749, ""name"": ""Romance""}]",,253235,"[{""id"": 2971, ""name"": ""grandfather granddaughter relationship""}, {""id"": 10226, ""name"": ""neighbor""}, {""id"": 10910, ""name"": ""wealthy""}, {""id"": 172971, ""name"": ""elderly""}, {""id"": 193049, ""name"": ""estrangement""}]",en,And So It Goes,A self-centered realtor enlists the help of his neighbor when he's suddenly left in charge of the granddaughter he never knew existed until his estranged son drops her off at his home.,9.633711,"[{""name"": ""Castle Rock Entertainment"", ""id"": 97}, {""name"": ""Envision Entertainment"", ""id"": 31832}, {""name"": ""ASIG Productions"", ""id"": 32245}]","[{""iso_3166_1"": ""US"", ""name"": ""United States of America""}]",2014-07-20 00:00:00,25312387,94.0,"[{""iso_639_1"": ""en"", ""name"": ""English""}]",Released,,And So It Goes,5.7,164
2375,18000000,"[{""id"": 12, ""name"": ""Adventure""}, {""id"": 18, ""name"": ""Drama""}, {""id"": 878, ""name"": ""Science Fiction""}]",http://www.midnightspecialmovie.com/,245703,"[{""id"": 494, ""name"": ""father son relationship""}, {""id"": 720, ""name"": ""helicopter""}, {""id"": 1812, ""name"": ""fbi""}, {""id"": 2669, ""name"": ""motel""}, {""id"": 3713, ""name"": ""chase""}, {""id"": 170865, ""name"": ""child kidnapping""}, {""id"": 173177, ""name"": ""religious sect""}, {""id"": 226471, ""name"": ""goggles""}]",en,Midnight Special,A father and son go on the run after the dad learns his child possesses special powers.,32.717853000000005,"[{""name"": ""Warner Bros."", ""id"": 6194}, {""name"": ""Faliro House Productions"", ""id"": 19246}, {""name"": ""Tri-State Pictures"", ""id"": 50914}]","[{""iso_3166_1"": ""US"", ""name"": ""United States of America""}]",2016-02-18 00:00:00,6212282,112.0,"[{""iso_639_1"": ""en"", ""name"": ""English""}]",Released,He's not like us.,Midnight Special,6.2,694
2379,0,"[{""id"": 27, ""name"": ""Horror""}]",,396152,[],en,Restoration,"During home renovations, a young couple release a fiery spirit seeking retribution. To save themselves and set the spirit free, they must uncover the dire truth. But nothing is as simple as it seems...",2.525569,[],[],2016-05-03 00:00:00,0,90.0,"[{""iso_639_1"": ""en"", ""name"": ""English""}]",Released,,Restoration,5.3,11
2388,18000000,"[{""id"": 28, ""name"": ""Action""}, {""id"": 80, ""name"": ""Crime""}, {""id"": 18, ""name"": ""Drama""}, {""id"": 53, ""name"": ""Thriller""}]",,332411,"[{""id"": 9748, ""name"": ""revenge""}, {""id"": 9826, ""name"": ""murder""}, {""id"": 11734, ""name"": ""police corruption""}, {""id"": 14819, ""name"": ""violence""}, {""id"": 156024, ""name"": ""corrupt politician""}, {""id"": 189368, ""name"": ""barber""}, {""id"": 226268, ""name"": ""governer""}]",en,I Am Wrath,A man is out for justice after a group of corrupt police officers are unable to catch his wife's killer.,10.144222000000001,"[{""name"": ""Patriot Pictures"", ""id"": 2373}, {""name"": ""Vallelonga Productions"", ""id"": 3084}, {""name"": ""Vengeance is Mine Productions"", ""id"": 73316}, {""name"": ""Hannibal Classics"", ""id"": 76777}]","[{""iso_3166_1"": ""US"", ""name"": ""United States of America""}]",2016-04-14 00:00:00,0,92.0,"[{""iso_639_1"": ""en"", ""name"": ""English""}]",Released,I lay my vengeance upon them.,I Am Wrath,4.5,179
2394,18000000,"[{""id"": 27, ""name"": ""Horror""}, {""id"": 28, ""name"": ""Action""}]",,290555,"[{""id"": 2393, ""name"": ""adoption""}, {""id"": 12564, ""name"": ""werewolf""}]",en,Wolves,"The coming-of-age story of Cayden Richards. Forced to hit the road after the murder of his parents, Cayden wanders lost without purpose... Until he meets a certifiable lunatic named Wild Joe who sets him on a path to the ominous town of Lupine Ridge to hunt down the truths of his history. But in the end| who's really hunting whom?",7.922639,"[{""name"": ""Copperheart Entertainment"", ""id"": 5106}, {""name"": ""Entertainment One"", ""id"": 8147}, {""name"": ""Dark Hero Studios"", ""id"": 49925}]","[{""iso_3166_1"": ""CA"", ""name"": ""Canada""}, {""iso_3166_1"": ""FR"", ""name"": ""France""}]",2014-08-28 00:00:00,0,90.0,"[{""iso_639_1"": ""en"", ""name"": ""English""}]",Released,Unleash the beast,Wolves,5.7,82
2400,18000000,"[{""id"": 53, ""name"": ""Thriller""}, {""id"": 28, ""name"": ""Action""}]",,241254,"[{""id"": 11578, ""name"": ""mobster""}, {""id"": 15108, ""name"": ""justice""}, {""id"": 18115, ""name"": ""retired""}, {""id"": 184402, ""name"": ""missing""}, {""id"": 197430, ""name"": ""missing daughter""}]",en,The Prince,A family man who turns out to be a retired mob enforcer must travel across the country to find his daughter who has gone missing.,21.638673,"[{""name"": ""Grindstone Entertainment Group"", ""id"": 3604}, {""name"": ""Emmett/Furla Films"", ""id"": 10405}, {""name"": ""Oasis Films"", ""id"": 33831}, {""name"": ""Aperture Entertainment"", ""id"": 33832}]","[{""iso_3166_1"": ""US"", ""name"": ""United States of America""}]",2014-08-22 00:00:00,266586800,93.0,"[{""iso_639_1"": ""en"", ""name"": ""English""}]",Released,Mercy is for the Weak,The Prince,4.6,218
2406,17000000,"[{""id"": 35, ""name"": ""Comedy""}]",,193893,"[{""id"": 417, ""name"": ""corruption""}, {""id"": 642, ""name"": ""robbery""}, {""id"": 1930, ""name"": ""kidnapping""}, {""id"": 2334, ""name"": ""nightclub""}, {""id"": 3230, ""name"": ""male friendship""}, {""id"": 5340, ""name"": ""investigation""}, {""id"": 6149, ""name"": ""police""}, {""id"": 8508, ""name"": ""party""}, {""id"": 9826, ""name"": ""murder""}, {""id"": 11578, ""name"": ""mobster""}, {""id"": 12670, ""name"": ""los angeles""}, {""id"": 170682, ""name"": ""lying""}, {""id"": 185071, ""name"": ""impersonating a police officer""}, {""id"": 187844, ""name"": ""flashback""}]",en,Let's Be Cops,"It's the ultimate buddy cop movie except for one thing: they're not cops.  When two struggling pals dress as police officers for a costume party, they become neighborhood sensations.  But when these newly-minted “heroes” get tangled in a real life web of mobsters and dirty detectives, they must put their fake badges on the line.",70.66892299999999,"[{""name"": ""Twentieth Century Fox Film Corporation"", ""id"": 306}, {""name"": ""WideAwake"", ""id"": 28787}, {""name"": ""Genre Films"", ""id"": 28788}]","[{""iso_3166_1"": ""US"", ""name"": ""United States of America""}]",2014-08-13 00:00:00,136621271,104.0,"[{""iso_639_1"": ""en"", ""name"": ""English""}]",Released,Fake Cops. Real Trouble.,Let's Be Cops,6.4,1219
